{
  "$schema": "https://json-schema.org/draft/2020-12/schema",
  "$defs": {
    "Connection": {
      "additionalProperties": false,
      "description": "An welcher Wallbox das Fahrzeug laedt.",
      "properties": {
        "station_id": {
          "anyOf": [
            {
              "type": "string"
            },
            {
              "type": "null"
            }
          ],
          "default": null,
          "description": "ID der Wallbox, an der das Fahrzeug laedt, ob es gerade steckt oder nicht. null heisst: es laedt in keinem Slot.",
          "title": "Station Id"
        },
        "since": {
          "anyOf": [
            {
              "format": "date-time",
              "type": "string"
            },
            {
              "type": "null"
            }
          ],
          "default": null,
          "description": "Zeitpunkt, seit dem das Fahrzeug an dieser Wallbox steckt. Der Plan rechnet nicht damit.",
          "title": "Since"
        }
      },
      "title": "Connection",
      "type": "object"
    },
    "ConsumptionEntry": {
      "additionalProperties": false,
      "description": "Eine geplante Fahrt im Wochenraster.",
      "properties": {
        "weekday": {
          "description": "Wochentag der Fahrt: 0 ist Montag, 6 ist Sonntag.",
          "maximum": 6,
          "minimum": 0,
          "title": "Weekday",
          "type": "integer"
        },
        "time": {
          "description": "Abfahrtszeit als HH:MM, gelesen in der timezone des Requests.",
          "pattern": "^([01]\\d|2[0-3]):[0-5]\\d$",
          "title": "Time",
          "type": "string"
        },
        "km": {
          "description": "Strecke dieser Fahrt in Kilometern.",
          "minimum": 0,
          "title": "Km",
          "type": "number"
        }
      },
      "required": [
        "weekday",
        "time",
        "km"
      ],
      "title": "ConsumptionEntry",
      "type": "object"
    },
    "ConsumptionModel": {
      "additionalProperties": false,
      "description": "Wie viel das Fahrzeug zwischen den Ladevorgaengen verbraucht.",
      "properties": {
        "type": {
          "description": "none rechnet ohne Verbrauch, daily mit einer Tagesstrecke, detailed mit einzelnen Fahrten im Wochenraster, trips mit einzelnen Fahrten zu festen Zeitpunkten.",
          "enum": [
            "none",
            "daily",
            "detailed",
            "trips"
          ],
          "title": "Type",
          "type": "string"
        },
        "daily_km": {
          "anyOf": [
            {
              "minimum": 0,
              "type": "number"
            },
            {
              "type": "null"
            }
          ],
          "default": null,
          "description": "Taegliche Fahrstrecke in Kilometern. Pflicht bei type daily, sie wird am ersten Slot jedes kommenden Tages gebucht.",
          "title": "Daily Km"
        },
        "entries": {
          "anyOf": [
            {
              "items": {
                "$ref": "#/$defs/ConsumptionEntry"
              },
              "type": "array"
            },
            {
              "type": "null"
            }
          ],
          "default": null,
          "description": "Die einzelnen Fahrten im Wochenraster. Pflicht bei type detailed; gebucht wird nur, was nach dem Planungsbeginn liegt.",
          "title": "Entries"
        },
        "trips": {
          "anyOf": [
            {
              "items": {
                "$ref": "#/$defs/ConsumptionTrip"
              },
              "type": "array"
            },
            {
              "type": "null"
            }
          ],
          "default": null,
          "description": "Die einzelnen Fahrten zu festen Zeitpunkten. Pflicht bei type trips, die Liste darf leer sein; gebucht wird nur, was nach dem Planungsbeginn liegt.",
          "title": "Trips"
        },
        "daily_floor_compensation": {
          "default": true,
          "description": "Hebt den Ladeboden um den Tagesverbrauch an, damit soc_min_pct auch nach der Fahrt noch gilt. Der angehobene Boden wird bei soc_max_pct gedeckelt und wirkt nur bei type daily.",
          "title": "Daily Floor Compensation",
          "type": "boolean"
        }
      },
      "required": [
        "type"
      ],
      "title": "ConsumptionModel",
      "type": "object"
    },
    "ConsumptionTrip": {
      "additionalProperties": false,
      "description": "Eine Fahrt zu einem festen Zeitpunkt.",
      "properties": {
        "departure": {
          "description": "Abfahrt der Fahrt. Ihr Verbrauch wird in dem Slot gebucht, in den dieser Zeitpunkt faellt.",
          "format": "date-time",
          "title": "Departure",
          "type": "string"
        },
        "km": {
          "description": "Strecke dieser Fahrt in Kilometern.",
          "minimum": 0,
          "title": "Km",
          "type": "number"
        }
      },
      "required": [
        "departure",
        "km"
      ],
      "title": "ConsumptionTrip",
      "type": "object"
    },
    "EfficiencyPoint": {
      "additionalProperties": false,
      "description": "Ein Stuetzpunkt der Ladekurve: welcher Wirkungsgrad bei welcher Leistung gilt.",
      "properties": {
        "kw": {
          "description": "Ladeleistung in kW, fuer die dieser Wirkungsgrad gilt.",
          "exclusiveMinimum": 0,
          "title": "Kw",
          "type": "number"
        },
        "eta": {
          "description": "Wirkungsgrad zwischen 0 und 1 bei dieser Leistung.",
          "exclusiveMinimum": 0,
          "maximum": 1,
          "title": "Eta",
          "type": "number"
        }
      },
      "required": [
        "kw",
        "eta"
      ],
      "title": "EfficiencyPoint",
      "type": "object"
    },
    "Site": {
      "additionalProperties": false,
      "description": "Die Rahmenwerte des Standorts: Anschlussgrenze und Netzentgelt.",
      "properties": {
        "max_power_kw": {
          "anyOf": [
            {
              "exclusiveMinimum": 0,
              "type": "number"
            },
            {
              "type": "null"
            }
          ],
          "default": null,
          "description": "Grenze des Hausanschlusses in kW. Der Plan haelt sie nicht ein, sondern warnt, wenn die geplante Spitzenlast darueber liegt.",
          "title": "Max Power Kw"
        },
        "grid_fees_eur_kwh": {
          "anyOf": [
            {
              "minimum": 0,
              "type": "number"
            },
            {
              "type": "null"
            }
          ],
          "default": null,
          "description": "Netzentgelt in EUR je kWh. Steht es im Request, weist die Antwort zusaetzlich die Kosten einschliesslich Entgelt aus.",
          "title": "Grid Fees Eur Kwh"
        }
      },
      "title": "Site",
      "type": "object"
    },
    "Station": {
      "additionalProperties": false,
      "description": "Eine Wallbox am Standort.",
      "properties": {
        "id": {
          "description": "Vom Client vergebene ID der Wallbox. Sie bleibt ueber Requests hinweg stabil; der Server erfindet nie eine.",
          "minLength": 1,
          "title": "Id",
          "type": "string"
        },
        "max_power_kw": {
          "description": "Hoechste Leistung in kW, die diese Wallbox abgeben kann.",
          "exclusiveMinimum": 0,
          "title": "Max Power Kw",
          "type": "number"
        },
        "available": {
          "default": true,
          "description": "false plant jedes Fahrzeug an dieser Wallbox so, als koenne es ueber den ganzen Horizont nicht laden.",
          "title": "Available",
          "type": "boolean"
        }
      },
      "required": [
        "id",
        "max_power_kw"
      ],
      "title": "Station",
      "type": "object"
    },
    "TargetConstraint": {
      "additionalProperties": false,
      "description": "Bis zu einem Zeitpunkt soll ein bestimmter Ladestand erreicht sein.",
      "properties": {
        "id": {
          "description": "Vom Client vergebene ID dieses Constraints. Sie taucht in der Antwort als Grund eines Slots wieder auf. base ist reserviert und wird abgewiesen.",
          "minLength": 1,
          "title": "Id",
          "type": "string"
        },
        "label": {
          "anyOf": [
            {
              "type": "string"
            },
            {
              "type": "null"
            }
          ],
          "default": null,
          "description": "Freier Text zur Anzeige, etwa der Anlass der Fahrt. Der Plan rechnet nicht damit.",
          "title": "Label"
        },
        "type": {
          "const": "target",
          "description": "Kennzeichnet diesen Constraint als Zielvorgabe.",
          "title": "Type",
          "type": "string"
        },
        "deadline": {
          "description": "Zeitpunkt, zu dem der Ladestand erreicht sein soll.",
          "format": "date-time",
          "title": "Deadline",
          "type": "string"
        },
        "target_soc_pct": {
          "description": "Ladestand in Prozent, der bis zur deadline erreicht sein soll. Ein Ziel wird nie gekappt: es hebt die Obergrenze ueber soc_max_pct hinaus an, solange es gilt.",
          "maximum": 100,
          "minimum": 0,
          "title": "Target Soc Pct",
          "type": "number"
        },
        "earliest_start": {
          "anyOf": [
            {
              "format": "date-time",
              "type": "string"
            },
            {
              "type": "null"
            }
          ],
          "default": null,
          "description": "Fruehester Zeitpunkt, ab dem fuer dieses Ziel geladen werden darf. Der Slot, der hier beginnt, ist der erste erlaubte.",
          "title": "Earliest Start"
        }
      },
      "required": [
        "id",
        "type",
        "deadline",
        "target_soc_pct"
      ],
      "title": "TargetConstraint",
      "type": "object"
    },
    "UnavailableConstraint": {
      "additionalProperties": false,
      "description": "Ein Zeitraum, in dem das Fahrzeug nicht geladen werden kann.",
      "properties": {
        "id": {
          "description": "Vom Client vergebene ID dieses Constraints. Sie taucht in der Antwort als Grund eines Slots wieder auf. base ist reserviert und wird abgewiesen.",
          "minLength": 1,
          "title": "Id",
          "type": "string"
        },
        "label": {
          "anyOf": [
            {
              "type": "string"
            },
            {
              "type": "null"
            }
          ],
          "default": null,
          "description": "Freier Text zur Anzeige, etwa der Anlass der Fahrt. Der Plan rechnet nicht damit.",
          "title": "Label"
        },
        "type": {
          "const": "unavailable",
          "description": "Kennzeichnet diesen Constraint als Abwesenheit.",
          "title": "Type",
          "type": "string"
        },
        "from": {
          "description": "Beginn des Zeitraums. Dieser Zeitpunkt gehoert noch dazu.",
          "format": "date-time",
          "title": "From",
          "type": "string"
        },
        "to": {
          "description": "Ende des Zeitraums. Dieser Zeitpunkt gehoert nicht mehr dazu.",
          "format": "date-time",
          "title": "To",
          "type": "string"
        }
      },
      "required": [
        "id",
        "type",
        "from",
        "to"
      ],
      "title": "UnavailableConstraint",
      "type": "object"
    },
    "VehicleProfile": {
      "additionalProperties": false,
      "description": "Ein Fahrzeug am Standort, mit seinem Zustand und seinen Terminen.",
      "properties": {
        "id": {
          "description": "Vom Client vergebene ID des Fahrzeugs. Sie bleibt ueber Requests hinweg stabil; der Server erfindet nie eine.",
          "minLength": 1,
          "title": "Id",
          "type": "string"
        },
        "capacity_kwh": {
          "description": "Nutzbare Kapazitaet der Batterie in kWh.",
          "exclusiveMinimum": 0,
          "title": "Capacity Kwh",
          "type": "number"
        },
        "soc_pct": {
          "description": "Ladestand in Prozent zum Zeitpunkt der Anfrage, gemessen am Fahrzeug.",
          "maximum": 100,
          "minimum": 0,
          "title": "Soc Pct",
          "type": "number"
        },
        "soc_measured_at": {
          "anyOf": [
            {
              "format": "date-time",
              "type": "string"
            },
            {
              "type": "null"
            }
          ],
          "default": null,
          "description": "Zeitpunkt, zu dem soc_pct gemessen wurde. Liegt er zu weit zurueck, traegt die Antwort eine Warnung.",
          "title": "Soc Measured At"
        },
        "max_charge_kw": {
          "description": "Hoechste Leistung in kW, die das Fahrzeug aufnehmen kann. Geladen wird mit dem kleineren Wert aus diesem und dem der Wallbox.",
          "exclusiveMinimum": 0,
          "title": "Max Charge Kw",
          "type": "number"
        },
        "efficiency_curve": {
          "description": "Wirkungsgrad ueber der Ladeleistung, als Stuetzpunkte. Dazwischen wird linear interpoliert, ausserhalb auf den naechsten Punkt geklemmt.",
          "items": {
            "$ref": "#/$defs/EfficiencyPoint"
          },
          "minItems": 1,
          "title": "Efficiency Curve",
          "type": "array"
        },
        "soc_min_pct": {
          "description": "Unterer Ladestand in Prozent, den der Plan im Regelbetrieb haelt.",
          "maximum": 100,
          "minimum": 0,
          "title": "Soc Min Pct",
          "type": "number"
        },
        "soc_max_pct": {
          "description": "Oberer Ladestand in Prozent, ueber den der Plan nur fuer ein Ziel hinaus laedt.",
          "maximum": 100,
          "minimum": 0,
          "title": "Soc Max Pct",
          "type": "number"
        },
        "consumption_kwh_per_100km": {
          "description": "Verbrauch des Fahrzeugs in kWh je 100 Kilometer.",
          "exclusiveMinimum": 0,
          "title": "Consumption Kwh Per 100Km",
          "type": "number"
        },
        "connection": {
          "$ref": "#/$defs/Connection"
        },
        "consumption": {
          "$ref": "#/$defs/ConsumptionModel"
        },
        "constraints": {
          "description": "Termine und Abwesenheiten dieses Fahrzeugs. Ihre IDs muessen untereinander verschieden sein.",
          "items": {
            "discriminator": {
              "mapping": {
                "target": "#/$defs/TargetConstraint",
                "unavailable": "#/$defs/UnavailableConstraint"
              },
              "propertyName": "type"
            },
            "oneOf": [
              {
                "$ref": "#/$defs/TargetConstraint"
              },
              {
                "$ref": "#/$defs/UnavailableConstraint"
              }
            ]
          },
          "title": "Constraints",
          "type": "array"
        }
      },
      "required": [
        "id",
        "capacity_kwh",
        "soc_pct",
        "max_charge_kw",
        "efficiency_curve",
        "soc_min_pct",
        "soc_max_pct",
        "consumption_kwh_per_100km",
        "consumption"
      ],
      "title": "VehicleProfile",
      "type": "object"
    }
  },
  "additionalProperties": false,
  "description": "Eine Plan-Anfrage. Sie beschreibt immer einen ganzen Standort, nie ein\neinzelnes Fahrzeug.",
  "properties": {
    "schema_version": {
      "description": "Version des Kontrakts, gegen den dieser Request gebaut ist.",
      "enum": [
        2
      ],
      "title": "Schema Version",
      "type": "integer"
    },
    "now": {
      "anyOf": [
        {
          "format": "date-time",
          "type": "string"
        },
        {
          "type": "null"
        }
      ],
      "default": null,
      "description": "Zeitpunkt, ab dem geplant wird. Fehlt er, nimmt der Server seine eigene Uhr.",
      "title": "Now"
    },
    "model": {
      "default": "default",
      "description": "Name des Prognosemodells. default folgt dem jeweils empfohlenen.",
      "title": "Model",
      "type": "string"
    },
    "risk": {
      "default": 2,
      "description": "Welches Quantil der Preisprognose der Plan verwendet: 1 wartet auf guenstige Slots und geht ins Risiko, 2 ist ausgewogen, 3 laedt frueh und sichert ab.",
      "enum": [
        1,
        2,
        3
      ],
      "title": "Risk",
      "type": "integer"
    },
    "timezone": {
      "default": "Europe/Berlin",
      "description": "Zeitzone, in der die Tagesgrenzen der Verbrauchsprognose liegen.",
      "title": "Timezone",
      "type": "string"
    },
    "site": {
      "$ref": "#/$defs/Site",
      "description": "Die Rahmenwerte des Standorts."
    },
    "stations": {
      "description": "Die Wallboxen am Standort, mindestens eine.",
      "items": {
        "$ref": "#/$defs/Station"
      },
      "minItems": 1,
      "title": "Stations",
      "type": "array"
    },
    "vehicles": {
      "description": "Die Fahrzeuge am Standort, mindestens eines.",
      "items": {
        "$ref": "#/$defs/VehicleProfile"
      },
      "minItems": 1,
      "title": "Vehicles",
      "type": "array"
    },
    "include_intervals": {
      "default": true,
      "description": "false laesst die abgeleiteten Ladebloecke in der Antwort weg und liefert nur die Slots.",
      "title": "Include Intervals",
      "type": "boolean"
    }
  },
  "required": [
    "schema_version",
    "stations",
    "vehicles"
  ],
  "title": "PlanRequest",
  "type": "object"
}
