{
  "schema_version": 2,
  "now": "2026-08-18T22:00:00+02:00",
  "model": "wx_syslag_2023",
  "risk": 2,
  "timezone": "Europe/Berlin",
  "site": {},
  "stations": [
    {
      "id": "wb",
      "max_power_kw": 11.0
    }
  ],
  "vehicles": [
    {
      "id": "auto-a",
      "capacity_kwh": 58.0,
      "soc_pct": 47.0,
      "max_charge_kw": 11.0,
      "efficiency_curve": [
        {
          "kw": 11.0,
          "eta": 0.94
        }
      ],
      "soc_min_pct": 15.0,
      "soc_max_pct": 80.0,
      "consumption_kwh_per_100km": 19.5,
      "connection": {
        "station_id": "wb"
      },
      "consumption": {
        "type": "none"
      },
      "constraints": [
        {
          "type": "unavailable",
          "id": "gone-1",
          "from": "2026-08-18T22:00:00+02:00",
          "to": "2026-08-18T23:00:00+02:00"
        }
      ]
    }
  ],
  "include_intervals": true
}
